UC1_Create_DataBase

mysql> create database payroll_service;
ERROR 1007 (HY000): Can't create database 'payroll_service'; database exists
mysql> create database payroll_service_new;
Query OK, 1 row affected (0.55 sec)

mysql> show databases;
+---------------------+
| Database            |
+---------------------+
| demo                |
| information_schema  |
| mysql               |
| payroll_service     |
| payroll_service_new |
| performance_schema  |
| sys                 |
+---------------------+
7 rows in set (0.26 sec)

UC2_Create_Table

mysql> use payroll_service_new
Database changed
mysql> create table employee_payroll(
    -> id int unsigned not null auto_increment,
    -> name varchar(100) not null,
    -> salary double not null,
    -> start date not null,
    -> primary key(id));
Query OK, 0 rows affected (0.26 sec)

mysql> desc employee_payroll;
+--------+--------------+------+-----+---------+----------------+
| Field  | Type         | Null | Key | Default | Extra          |
+--------+--------------+------+-----+---------+----------------+
| id     | int unsigned | NO   | PRI | NULL    | auto_increment |
| name   | varchar(100) | NO   |     | NULL    |                |
| salary | double       | NO   |     | NULL    |                |
| start  | date         | NO   |     | NULL    |                |
+--------+--------------+------+-----+---------+----------------+
4 rows in set (0.08 sec)

UC3_Insert_DataBase

mysql> insert into employee_payroll(name,salary,start)values ('Bill',1000000.00,'2010-10-30'),('Tersia',2000000.00,'2019-11-13'),('Charlie',300000.00,'2020-05-21');
Query OK, 3 rows affected (0.16 sec)
Records: 3  Duplicates: 0  Warnings: 0

UC4_Retrieve_DataBase

mysql> select * from employee_payroll
    -> ;
+----+---------+---------+------------+
| id | name    | salary  | start      |
+----+---------+---------+------------+
|  1 | Bill    | 1000000 | 2010-10-30 |
|  2 | Tersia  | 2000000 | 2019-11-13 |
|  3 | Charlie |  300000 | 2020-05-21 |
+----+---------+---------+------------+
3 rows in set (0.00 sec)

UC5_Retrieve_Salary_DataBase

select salary from employee_payroll where name = 'Bill';
+---------+
| salary  |
+---------+
| 1000000 |
+---------+
1 row in set (0.00 sec)
select salary from employee_payroll where start between cast('2018-01-01' as date) and date (now());
+---------+
| salary  |
+---------+
| 2000000 |
|  300000 |
+---------+
2 rows in set (0.04 sec)
 select * from employee_payroll where start between cast('2018-01-01' as date) and date(now());
+----+---------+---------+------------+
| id | name    | salary  | start      |
+----+---------+---------+------------+
|  2 | Tersia  | 2000000 | 2019-11-13 |
|  3 | Charlie |  300000 | 2020-05-21 |
+----+---------+---------+------------+
2 rows in set (0.00 sec)

mysql> select* from employee_payroll where start between cast('2020-01-01' as date) and date(now());
+----+---------+--------+------------+
| id | name    | salary | start      |
+----+---------+--------+------------+
|  3 | Charlie | 300000 | 2020-05-21 |
+----+---------+--------+------------+
1 row in set (0.00 sec)

UC6_Adding_Gender_To_The_Table

 alter table employee_payroll add gender char(1) after name;
Query OK, 0 rows affected (0.20 sec)
Records: 0  Duplicates: 0  Warnings: 0

mysql> desc employee_payroll;
+--------+--------------+------+-----+---------+----------------+
| Field  | Type         | Null | Key | Default | Extra          |
+--------+--------------+------+-----+---------+----------------+
| id     | int unsigned | NO   | PRI | NULL    | auto_increment |
| name   | varchar(100) | NO   |     | NULL    |                |
| gender | char(1)      | YES  |     | NULL    |                |
| salary | double       | NO   |     | NULL    |                |
| start  | date         | NO   |     | NULL    |                |
+--------+--------------+------+-----+---------+----------------+
5 rows in set (0.00 sec)
update employee_payroll set gender = 'M'  where name = 'Bill' or  name = 'Charlie'
    -> ;
Query OK, 2 rows affected (0.14 sec)
Rows matched: 2  Changed: 2  Warnings: 0

mysql> select * from employee_payroll;
+----+---------+--------+---------+------------+
| id | name    | gender | salary  | start      |
+----+---------+--------+---------+------------+
|  1 | Bill    | M      | 1000000 | 2010-10-30 |
|  2 | Tersia  | NULL   | 2000000 | 2019-11-13 |
|  3 | Charlie | M      |  300000 | 2020-05-21 |
+----+---------+--------+---------+------------+
3 rows in set (0.00 sec)

mysql> update employee_payroll set gender = 'F'  where name = 'Tersia';
Query OK, 1 row affected (0.07 sec)
Rows matched: 1  Changed: 1  Warnings: 0

mysql> select * from employee_payroll;
+----+---------+--------+---------+------------+
| id | name    | gender | salary  | start      |
+----+---------+--------+---------+------------+
|  1 | Bill    | M      | 1000000 | 2010-10-30 |
|  2 | Tersia  | F      | 2000000 | 2019-11-13 |
|  3 | Charlie | M      |  300000 | 2020-05-21 |
+----+---------+--------+---------+------------+
3 rows in set (0.00 sec)

UC7_Find_Sum_Avg_Of_Salary_And_Count_From_Table

select sum(salary) from employee_payroll where gender = 'M' group by gender;
+-------------+
| sum(salary) |
+-------------+
|     1300000 |
+-------------+
1 row in set (0.06 sec)

mysql> select avg(salary) from employee_payroll where gender = 'M' group by gender;
+-------------+
| avg(salary) |
+-------------+
|      650000 |
+-------------+
1 row in set (0.00 sec)
select gender, count(salary) from employee_payroll group by gender;
+--------+---------------+
| gender | count(salary) |
+--------+---------------+
| M      |             2 |
| F      |             1 |
+--------+---------------+
2 rows in set (0.02 sec)

mysql> select min(salary) from employee_payroll where gender = 'M' group by gender;
+-------------+
| min(salary) |
+-------------+
|      300000 |
+-------------+
1 row in set (0.01 sec)
 select max(salary) from employee_payroll where gender = 'F' group by gender;
+-------------+
| max(salary) |
+-------------+
|     2000000 |
+-------------+
1 row in set (0.00 sec)

mysql> select count(salary) from employee_payroll where gender = 'M' group by gender;
+---------------+
| count(salary) |
+---------------+
|             2 |
+---------------+
1 row in set (0.00 sec)
select count(salary) from employee_payroll where gender = 'F' group by gender;
+---------------+
| count(salary) |
+---------------+
|             1 |
+---------------+
1 row in set (0.00 sec)

UC8-Extend employee payroll data to store employee information like phone,address and department

 alter table Employee_Payroll add phone_number varchar(250) after name;ame;
Query OK, 0 rows affected (0.23 sec)
Records: 0  Duplicates: 0  Warnings: 0
 alter table Employee_Payroll add address varchar(250) after phone_number;
Query OK, 0 rows affected (0.14 sec)
Records: 0  Duplicates: 0  Warnings: 0
 alter table Employee_Payroll add department varchar(150) not null after address;
Query OK, 0 rows affected (0.14 sec)
Records: 0  Duplicates: 0  Warnings: 0
select * from Employee_Payroll;
+----+---------+--------------+---------+------------+--------+---------+------------+
| id | name    | phone_number | address | department | gender | salary  | start      |
+----+---------+--------------+---------+------------+--------+---------+------------+
|  1 | Bill    | NULL         | NULL    |            | M      | 1000000 | 2010-10-30 |
|  2 | Tersia  | NULL         | NULL    |            | F      | 2000000 | 2019-11-13 |
|  3 | Charlie | NULL         | NULL    |            | M      |  300000 | 2020-05-21 |
+----+---------+--------------+---------+------------+--------+---------+------------+
3 rows in set (0.00 sec)
 alter table Employee_Payroll alter address set default 'TBD';
Query OK, 0 rows affected (0.14 sec)
Records: 0  Duplicates: 0  Warnings: 0

mysql> select * from Employee_Payroll;
+----+---------+--------------+---------+------------+--------+---------+------------+
| id | name    | phone_number | address | department | gender | salary  | start      |
+----+---------+--------------+---------+------------+--------+---------+------------+
|  1 | Bill    | NULL         | NULL    |            | M      | 1000000 | 2010-10-30 |
|  2 | Tersia  | NULL         | NULL    |            | F      | 2000000 | 2019-11-13 |
|  3 | Charlie | NULL         | NULL    |            | M      |  300000 | 2020-05-21 |
+----+---------+--------------+---------+------------+--------+---------+------------+
3 rows in set (0.00 sec)
 desc Employee_Payroll;
+--------------+--------------+------+-----+---------+----------------+
| Field        | Type         | Null | Key | Default | Extra          |
+--------------+--------------+------+-----+---------+----------------+
| id           | int unsigned | NO   | PRI | NULL    | auto_increment |
| name         | varchar(100) | NO   |     | NULL    |                |
| phone_number | varchar(250) | YES  |     | NULL    |                |
| address      | varchar(250) | YES  |     | TBD     |                |
| department   | varchar(150) | NO   |     | NULL    |                |
| gender       | char(1)      | YES  |     | NULL    |                |
| salary       | double       | NO   |     | NULL    |                |
| start        | date         | NO   |     | NULL    |                |
+--------------+--------------+------+-----+---------+----------------+
8 rows in set (0.11 sec)

UC9-Extend employee payroll table to have basic pay,deductions,taxable pay,income tax,net pay

 alter table Employee_Payroll rename column salary to basic_pay;
Query OK, 0 rows affected (0.10 sec)
Records: 0  Duplicates: 0  Warnings: 0

mysql> select * from Employee_Payroll;
+----+---------+--------------+---------+------------+--------+-----------+------------+
| id | name    | phone_number | address | department | gender | basic_pay | start      |
+----+---------+--------------+---------+------------+--------+-----------+------------+
|  1 | Bill    | NULL         | NULL    |            | M      |   1000000 | 2010-10-30 |
|  2 | Tersia  | NULL         | NULL    |            | F      |   2000000 | 2019-11-13 |
|  3 | Charlie | NULL         | NULL    |            | M      |    300000 | 2020-05-21 |
+----+---------+--------------+---------+------------+--------+-----------+------------+
3 rows in set (0.00 sec)
alter table Employee_Payroll add deductions double not null after basic_pay;
Query OK, 0 rows affected (0.10 sec)
Records: 0  Duplicates: 0  Warnings: 0

mysql> alter table Employee_Payroll add taxable_pay double not null after deductions;
Query OK, 0 rows affected (0.10 sec)
Records: 0  Duplicates: 0  Warnings: 0

mysql> alter table Employee_Payroll add tax double not null after taxable_pay;
Query OK, 0 rows affected (0.10 sec)
Records: 0  Duplicates: 0  Warnings: 0

mysql> alter table Employee_Payroll add net_pay double not null after tax;
Query OK, 0 rows affected (0.10 sec)
Records: 0  Duplicates: 0  Warnings: 0

mysql> select * from Employee_Payroll;
+----+---------+--------------+---------+------------+--------+-----------+------------+-------------+-----+---------+------------+
| id | name    | phone_number | address | department | gender | basic_pay | deductions | taxable_pay | tax | net_pay | start      |
+----+---------+--------------+---------+------------+--------+-----------+------------+-------------+-----+---------+------------+
|  1 | Bill    | NULL         | NULL    |            | M      |   1000000 |          0 |           0 |   0 |       0 | 2010-10-30 |
|  2 | Tersia  | NULL         | NULL    |            | F      |   2000000 |          0 |           0 |   0 |       0 | 2019-11-13 |
|  3 | Charlie | NULL         | NULL    |            | M      |    300000 |          0 |           0 |   0 |       0 | 2020-05-21 |
+----+---------+--------------+---------+------------+--------+-----------+------------+-------------+-----+---------+------------+
3 rows in set (0.00 sec)